Article ID,Title,Year,Sentiment List,URL,Summary
1,A writing table anchors a home built on a grandfather’s tragic legacy.,2015,"[0.375, 0.0, 0.2972123579545454, 0.6, 0.8333333333333334, -0.01666666666666668, 0.07916666666666668, 0.5, 0.0, 0.13636363636363635, 0.0, 0.0, 0.7, 0.0, -0.284375]",https://www.nytimes.com/slideshow/2015/01/01/garden/20150101-DOMESTIC.html,James Gunn shared a pic with the cast of ‘Superman: Legacy’ following the first table read Source: [https://www.threads.net/@jamesgunn/post/C3qEO2vgBHP/](https://www.threads.net/@jamesgunn/post/C3qEO2vgBHP/) & [https://www.instagram.com/p/C3qExTkPYpl/](https://www.instagram.com/p/C3qExTkPYpl/) >James: After the table read with the #Superman cast.
2,"Building a modern loft in Portland, Ore., suffused with local character and treasured flaws.",2015,"[0.6, 0.12499999999999999, 0.4, 0.2583333333333333, 0.38, 0.6875, 0.0, -0.07142857142857144, 0.0, 0.0, 0.31785714285714284, 0.625, 0.3, -0.25, -0.2916666666666667]",https://www.nytimes.com/slideshow/2015/01/01/garden/20150101-LOCATION.html,"Building a modern loft in Portland, Ore., suffused with local character and treasured flaws."
3,"Building a loft in Portland, Ore., suffused with local character and treasured flaws.",2015,"[0.6, 0.12499999999999999, 0.4, 0.2583333333333333, 0.38, 0.6875, 0.0, -0.07142857142857144, 0.0, 0.0, 0.31785714285714284, 0.625, 0.3, -0.25, -0.2916666666666667]",https://www.nytimes.com/2015/01/01/garden/the-imperfectionists.html,"Building a loft in Portland, Ore., suffused with local character and treasured flaws."
4,A writing table anchors a home built on a grandfather’s tragic legacy.,2015,"[0.375, 0.0, 0.2972123579545454, 0.6, 0.8333333333333334, -0.01666666666666668, 0.07916666666666668, 0.5, 0.0, 0.13636363636363635, 0.0, 0.0, 0.7, 0.0, -0.284375]",https://www.nytimes.com/2015/01/01/garden/a-simple-gift-.html,James Gunn shared a pic with the cast of ‘Superman: Legacy’ following the first table read Source: [https://www.threads.net/@jamesgunn/post/C3qEO2vgBHP/](https://www.threads.net/@jamesgunn/post/C3qEO2vgBHP/) & [https://www.instagram.com/p/C3qExTkPYpl/](https://www.instagram.com/p/C3qExTkPYpl/) >James: After the table read with the #Superman cast.
5,Farhad Manjoo picks four products from 2014 that are bringing the future closer.,2015,"[0.2, 0.0, 0.0, -0.0009803921568627514, 0.1571428571428571, 0.3194444444444445, -0.09090909090909091, -0.15555555555555559, 0.13636363636363635, 0.0]",https://www.nytimes.com/2015/01/01/technology/personaltech/standouts-in-tech-drones-virtual-reality-instant-translation-and-ai.html,Deutsche Abiturienten sollten in der Englischprüfung eine Kolumne von Farhad Manjoo analysieren.
6,"After more than 30 years of serving up inexpensive food and drinks on West 72nd Street, the chain’s original restaurant will close for good on Wednesday night.",2015,"[0.0, 0.0, 0.0, 0.20277777777777775, 0.0, 0.5625, 0.08214285714285714, 0.04934318555008212, -0.0375, 0.13571428571428573, 0.22499999999999998, 0.05255952380952379, 0.4666666666666666, 0.15833333333333335, 0.2866666666666667]",https://www.nytimes.com/2015/01/01/nyregion/long-out-of-place-on-an-exclusive-manhattan-block-a-restaurant-moves-out.html,"After more than 30 years of serving up inexpensive food and drinks on West 72nd Street, the chain’s original restaurant will close for good on Wednesday night."
7,"Mr. Herrmann could be formidable or friendly and was often cast in movies and on television in affluent roles as a lawyer, judge or millionaire.",2015,"[0.525, 0.25, -0.04910714285714286, 0.04705882352941176, -0.3333333333333333, -0.06666666666666667, 0.16999999999999998, 0.7, 0.0, 0.21212121212121213, 0.45, 0.0, 0.0, 0.2642857142857143, 0.04999999999999999]",https://www.nytimes.com/2015/01/01/arts/television/edward-herrmann-actor-with-a-noble-air-dies-at-71.html,Stephen Oyoung wants to reprise his role as Mr. Negative in a Spider-Man movie Mr. Negative would be a pretty good pick for a live action villain.
8,"Canada outlasted the United States, 5-3, on Wednesday in the final game of group play at hockey’s World Junior Championship.",2015,"[0.075, 0.0, -0.15000000000000002, 0.0, -0.05, 0.2, 0.5, 0.22000000000000003, 0.0, 0.0, 0.0, 0.3, 0.44999999999999996, -0.1, 0.0]",https://www.nytimes.com/2015/01/01/sports/hockey/canada-holds-off-us-in-preliminary-junior-championship-match.html,"Canada outlasted the United States, 5-3, on Wednesday in the final game of group play at hockey’s World Junior Championship."
9,"Readers, including Marc Rotenberg of the Electronic Privacy Information Center, fault a Federal Trade Commission strategy.",2015,"[0.0625, -0.145, -0.5, 0.026515151515151544, -0.054613095238095224, 0.5, -0.05714285714285715, 0.0, 0.31224489795918364, 0.0, 0.0, -0.05000000000000002]",https://www.nytimes.com/2015/01/01/opinion/online-privacy-who-writes-the-rules.html,"MVP Top privacy executives quit Twitter, raising questions about data security |"
10,A former teacher and librarian says the book series that helps children learn to read is worthy of being honored.,2015,"[-1.0, 0.5178571428571428, 0.0, 0.029183919944789503, -0.26999999999999996, -0.5, 0.09435064935064935, -0.03571428571428571, 0.0, -0.05, -0.00416666666666667, 0.2761904761904762, 0.19333333333333333, -0.025252525252525256, 0.21714285714285714]",https://www.nytimes.com/2015/01/01/opinion/defending-dick-and-jane.html,Rinderle is the first known public school teacher to be fired under Georgia’s trio of censorship laws passed in 2022.
11,A professor of Hispanic studies says the embargo should not be lifted until dissent is legalized.,2015,"[-0.024821428571428564, 0.0, 0.0, 0.0, 0.0, 0.0, 0.1142857142857143, 0.0, 0.11212121212121212, 0.06825396825396826, 0.05555555555555556, 0.10833333333333334, 0.0, 0.1318181818181818, 0.18134920634920637]",https://www.nytimes.com/2015/01/01/opinion/keep-the-cuban-embargo.html,A professor of Hispanic studies says the embargo should not be lifted until dissent is legalized.
12,A writer urges that airlines be compelled to upgrade flight-tracking technology.,2015,"[0.0, 0.5, 0.5, 0.25, 0.0, 0.7, 0.1696078431372549, 0.0, 0.0, 0.0, 5.551115123125783e-17, 0.0, 0.0, 0.0, -0.010185185185185195]",https://www.nytimes.com/2015/01/01/opinion/improving-flight-safety.html,"TIL that most airlines never use a flight number again if that flight has a fatal crash, except for American Airlines, which keeps using flight #1 despite three major crashes."
13,"Acknowledging that the emergency sirens on gates had done little to discourage fare evasion, the Metropolitan Transportation Authority said it was disabling them at all of its stations.",2015,"[-0.03749999999999999, 0.6166666666666667, 0.1, 0.0, 0.0, 0.46875, 0.0, 0.0, -0.1711111111111111, 0.23333333333333336, 0.1625, 0.0]",https://www.nytimes.com/2015/01/01/nyregion/exit-alarms-in-the-subways-are-silenced-by-the-mta.html,"Acknowledging that the emergency sirens on gates had done little to discourage fare evasion, the Metropolitan Transportation Authority said it was disabling them at all of its stations."
14,Ready to take the challenge to see how much you remember from 2014? No cheating and Googling for answers!,2015,"[0.3, 0.0, 0.19642857142857142, 0.08484848484848484, 0.0, 0.0, 0.125, 0.1273148148148148, 0.07023809523809524, 0.0, -0.25, 0.0, 0.3, 0.0, 0.0]",https://www.nytimes.com/interactive/2015/01/01/opinion/Gail-Collins-First-Pop-Quiz-of-2015.html,"A possible answer to Yuta's claim fo them ""cheating"" Am I cheating at the 100 baby challenge?"
15,"Gov. Andrew M. Cuomo announced on Wednesday that he had pardoned two men, one who had been convicted in a drug case and another who was convicted of robbery.",2015,"[0.7, 0.325, 0.1, 0.0, -0.28375, 0.0, -0.02916666666666667, 0.0, -0.05606060606060606, -0.01071428571428572, 0.0, 0.2, 0.0587012987012987, 0.36818181818181817, -0.3]",https://www.nytimes.com/2015/01/01/nyregion/cuomo-using-pardon-power-gives-pair-a-second-chance.html,Please [contact the moderators of this subreddit](/message/compose/?to=/r/politics) if you have any questions or concerns.* Gov. Andrew Cuomo Signs Bill Allowing Release Of Trump's State Tax Returns “Donald Trump has broken forty years of political tradition by not releasing his tax returns.
16,"Marrone, a Bronx native who opted out of his contract as Buffalo’s coach, served as the Jets’ offensive line coach for four seasons under Herman Edwards.",2015,"[0.5, -0.05, 0.0, 0.85, 0.10714285714285714, 0.5, -0.2916666666666667, 0.22499999999999998, 0.0, -0.3, 0.35, 0.65, 0.3333333333333333, -0.44999999999999996, 0.0]",https://www.nytimes.com/2015/01/01/sports/football/nfl-roundup.html,"Marrone, a Bronx native who opted out of his contract as Buffalo’s coach, served as the Jets’ offensive line coach for four seasons under Herman Edwards."
17,"Rigorous evidence should inform spending. Until lately, it hasn’t.",2015,"[0.10333333333333332, 0.07123015873015873, 0.05, 0.09999999999999999, 0.0, 0.342, 0.1285714285714286, 0.0, 0.1875, 0.11666666666666665, -0.09999999999999999, 0.0, -0.1, -0.07777777777777779, -0.4]",https://www.nytimes.com/2015/01/01/opinion/social-programs-that-work.html,What they reported spending it on is more evidence that universal basic income works.
18,A new law is a significant step forward in animal welfare.,2015,"[-0.07500000000000001, 0.019999999999999997, 0.1625, 0.026262626262626272, -0.008552631578947372, -0.07142857142857142, 0.2, 0.0, 0.3020833333333333, -0.07500000000000001, -0.2513888888888889, 0.0, 0.10416666666666667, -0.017310405643738966, -0.10112781954887218]",https://www.nytimes.com/2015/01/01/opinion/mark-bittman-hens-unbound.html,Iceland suspends whale hunt on animal welfare concerns Calls for legal action after ‘unimaginable suffering’ filmed at Devon pig farm |
19,Representative Steve Scalise’s effort to explain why he accepted a speaking engagement offered by an aide to Mr. Duke in 2002 was a reminder of choices Louisiana Republicans faced in the past.,2015,"[-0.02916666666666667, 0.0, -0.5888888888888889, 0.0, 0.5, 0.1, 0.05, 0.0, -1.0, 0.0, 0.5, 0.3, -0.1, -0.05, 0.0]",https://www.nytimes.com/2015/01/01/us/politics/much-of-david-dukes-91-campaign-is-now-in-louisiana-mainstream.html,Megathread: Steve Scalise Withdraws from Race for Speaker of the US House Scalise is the 2nd highest ranking member in the House GOP.
20,Distrust between the two countries has resurfaced as the search for nearly 300 kidnapped girls has lost momentum.,2015,"[0.0, 0.050000000000000044, 0.0, 0.3, 0.35, 0.5, 0.5, 0.0, 0.25, 0.0, 0.0, 0.0, 0.0, 0.0, 0.5]",https://www.nytimes.com/2015/01/01/world/with-schoolgirls-still-missing-fragile-us-nigeria-ties-falter.html,Distrust between the two countries has resurfaced as the search for nearly 300 kidnapped girls has lost momentum.
21,Union officials say policing the nightly demonstrations and the deaths of two officers have had an impact.,2015,"[0.2333333333333333, 0.2857142857142857, -0.0325, -0.175, 0.0, 0.025000000000000005, -0.3125, -0.00833333333333334, 0.0, 0.0, 0.0, -0.1, 0.16111111111111112, 0.0, 0.09999999999999998]",https://www.nytimes.com/2015/01/01/nyregion/arrest-statistics-decline-sharply-police-unions-deny-an-organized-slowdown.html,Thirty-two guards with the Florida Department of Corrections were fired Friday afternoon in what union officials were calling a “Friday night massacre.”
22,"Because of cost, airlines have been too slow to outfit planes with real-time data streaming.",2015,"[0.09435064935064935, 0.30000000000000004, 0.0, -0.19111111111111112, 0.0, 0.07142857142857144, 0.5, 0.7, -0.13333333333333333, -0.0049999999999999715, 0.0, 0.11666666666666665, -0.05000000000000001, 0.0, 0.007142857142857159]",https://www.nytimes.com/2015/01/01/opinion/after-airasia-flight-8501-a-need-for-tracking.html,"Biden to announce new rule requiring airlines to disclose ""true cost"" of plane tickets Oh no!"
23,The best matchup in this game is a battle between coaches.,2015,"[0.3, -0.3666666666666667, 0.3, 0.0, 0.5533333333333333, -0.2916666666666667, 0.0, 0.0, 0.6, 0.0, 0.0, 0.0, 0.0, 0.15, 0.0]",https://www.nytimes.com/2015/01/01/sports/ncaafootball/alabama-vs-ohio-state-sugar-bowl-preview-nick-saban-urban-meyer.html,The best matchup in this game is a battle between coaches.
24,"Florida State, an underdog by more than a touchdown, will play the lack-of-respect card against Oregon in a game that features this season’s and last season’s Heisman Trophy winners.",2015,"[0.25, -0.9, 0.25, 0.36750000000000005, -0.024999999999999967, 0.6166666666666667, 0.0, 0.13333333333333333, -0.06000000000000001, -0.875, 0.7, 0.8, -0.4, 0.475, -0.19642857142857142]",https://www.nytimes.com/2015/01/01/sports/ncaafootball/florida-state-oregon-rose-bowl-preview-jameis-winston-marcus-mariota.html,"Oregon quarterback Bo Nix visited #Seahawks this weekend, per a league source."
25,"By Jan. 1, 29 states and the District of Columbia will have minimum wages above the federal minimum wage of $7.25.",2015,"[-0.02916666666666667, -0.08, -0.14583333333333334, -0.07500000000000001, 0.0, 0.09285714285714285, 0.0, 0.1137671356421357, 0.0, -0.07500000000000001, 0.0, -0.04999999999999999, 0.0, 0.0, 0.4590909090909091]",https://www.nytimes.com/interactive/2014/12/31/business/economy/miniwage.html,"By Jan. 1, 29 states and the District of Columbia will have minimum wages above the federal minimum wage of $7.25."
26,Bill Cosby came close to escaping sexual assault charges. How many others do?,2016,[],https://www.nytimes.com/2016/01/01/opinion/no-more-statutes-of-limitations-for-rape.html,Bill Cosby came close to escaping sexual assault charges.
27,A court document made public on Thursday suggests that defense lawyers will argue that Mr. Gray was already injured when he was loaded into a Baltimore police van.,2016,"[-0.1, -0.041666666666666664, 0.3, 0.13522727272727272, 0.1, 0.0841880341880342, 0.0, 0.0, 0.2, -0.03888888888888888, -0.05, 0.0, 0.1875, 0.03589743589743589, 0.0]",https://www.nytimes.com/2016/01/01/us/freddie-gray-complained-of-bad-back-before-arrest-filing-says.html,A court document made public on Thursday suggests that defense lawyers will argue that Mr. Gray was already injured when he was loaded into a Baltimore police van.
28,"The average tax rate for America’s top 400 income earners rose in 2013, but tax analysts said the tax structure still overwhelmingly favors the very well-off.",2016,"[0.0215686274509804, 0.42857142857142855, -0.08499999999999999, 0.0, 0.20833333333333331, 0.15, 0.16666666666666666, 0.2375, 0.0, 0.0, 0.375, 0.35, 0.4, 0.0, 0.6]",https://www.nytimes.com/2016/01/01/business/economy/justice-in-taxes-most-likely-short-lived.html,"Liberals to 'go further' targeting high-income earners with budget's new minimum income tax > The most impactful change for government coffers announced in this budget is one that would ban private Canadian companies from using foreign corporations, such as shell companies based abroad or moving their headquarters to a tax haven despite still being fully Canadians owned and controlled, to avoid paying Canada’s tax rates."
29,"Led by quarterback Deshaun Watson, the Tigers defeated fourth-seeded Oklahoma in the first College Football Playoff semifinal.",2016,"[0.75, 0.0, 0.0, 0.125, 0.0, 0.7, -0.25, 0.0, 0.35, -0.3125, 0.26666666666666666, 0.25, 0.3, 0.2, 0.6]",https://www.nytimes.com/2016/01/01/sports/ncaafootball/clemson-beats-oklahoma-in-orange-bowl-college-football-playoff-semifinal.html,"Led by quarterback Deshaun Watson, the Tigers defeated fourth-seeded Oklahoma in the first College Football Playoff semifinal."
30,A federal judge has warned that prosecutors may be going too far when they ask witnesses to keep quiet about receiving a subpoena.,2016,"[-0.02916666666666667, -0.06547619047619048, 0.0, 0.11666666666666667, 0.38000000000000006, 0.10740740740740742, -0.07121212121212121, 0.19999999999999998, 0.023571428571428577, 0.2625, 0.5, 0.1, -0.02149621212121212, 0.0, 0.0]",https://www.nytimes.com/2016/01/01/nyregion/prosecutorssecrecy-orders-on-subpoenas-stir-constitutional-questions.html,“Judge Cannon has a lot to answer for”: Ex-Mueller prosecutor fumes after witness comes forward >Weissmann said Cannon “clearly is not going to have this trial” given all the roadblocks she has thrown up in pre-trial proceedings.
31,"William Ackman’s hedge fund said in a regulatory filing that its stake was now 8.5 percent, down from 9.9 percent, of the drug company that has been drawing fire on several fronts.",2016,"[-0.14583333333333331, 0.1, 0.0, 0.0, 0.0, 0.05357142857142857, 0.08545454545454545, -0.058333333333333334, 0.13749999999999998, 0.0, -0.3999999999999999, -0.4, 0.0, 0.0, 0.0]",https://www.nytimes.com/2016/01/01/business/dealbook/ackman-sheds-some-valeant-shares.html,"In order to prevent brigading and to encourage a civil discourse among neighbors, the comments section has been restricted to only r/Atlanta users with a sufficient history of positive posts and comments."
32,"A look at how government services in New York, New Jersey and Connecticut will be affected.",2016,"[0.04775641025641026, -0.04999999999999999, -0.5, 0.0, 0.5, -0.25, 0.3, 0.0, 0.18665584415584413, 0.09435064935064935, 0.0, 0.1502044252044252, 1.0, -0.5625, 0.0]",https://www.nytimes.com/2016/01/01/nyregion/holiday-today-new-years-day.html,"Please [contact the moderators of this subreddit](/message/compose/?to=/r/politics) if you have any questions or concerns.* Relevant [photo](https://static.independent.co.uk/2022/09/11/18/Screen%20Shot%202022-09-11%20at%201.01.55%20PM.png?width=1200) >FBI special agents have reportedly interviewed multiple witnesses regarding whether former president Donald Trump has hidden classified or sensitive government documents at his Trump Tower home and office or the Bedminster, New Jersey golf club where he has spent most summers since 2017."
33,"Davis, who was mourning his mother when he earned a gold medal at the 1976 Montreal Olympics, had more than 100 victories as an amateur but never won a world title.",2016,"[0.1, 0.4, 0.033333333333333326, 0.0, 0.6, 0.7, 0.2041666666666667, -0.05357142857142857, 0.0, 0.0, 0.625, 0.125, 0.0, 0.12999999999999998, 0.5]",https://www.nytimes.com/2016/01/01/sports/howard-davis-jr-who-beat-grief-to-win-boxing-gold-dies-at-59.html,"Davis, who was mourning his mother when he earned a gold medal at the 1976 Montreal Olympics, had more than 100 victories as an amateur but never won a world title."
34,Can greater defenses be erected? Should homes be vaulted on stilts? Or is it time for some communities to pack up and leave?,2016,"[0.2878427128427129, 0.16, 0.050811688311688315, 0.09435064935064935, -0.5, -0.16666666666666666, 0.0, -0.006249999999999999, 0.0625, 0.046428571428571416, 0.16666666666666669, 0.24285714285714283, 0.0, 0.08833333333333332, -0.8]",https://www.nytimes.com/2016/01/01/us/flooding-in-missouri-raises-vexing-questions.html,Defensive firearms for first-time gun owners: a comprehensive guide to selecting and buying a gun for home defense.
35,"Depending on whom you ask, the fault for the state of Bridge Park 2 lies with flawed zoning, communication breakdowns or the Jehovah’s Witnesses, who promised to fix it but never did.",2016,"[-0.12018140589569161, 0.21666666666666667, 0.19375, 0.1, 0.0, 0.1488095238095238, 0.0, 0.0, 0.0, 0.18333333333333335, 0.0, 0.475, -0.46875, 0.07187500000000001, 0.0]",https://www.nytimes.com/2016/01/01/nyregion/stalled-brooklyn-park-exposes-rift-with-religious-group.html,Jehovah's Witnesses sue the Dutch state for discrimination
36,"If a sports team rarely wins, why do some fans doggedly support it? Academics try to unravel the psychological quagmire.",2016,"[0.3080357142857143, 0.1, 0.0, 0.0, -0.6, 0.0, 0.15875000000000003, 0.265, -0.25, 0.07999999999999999, -0.8, 0.0, 0.1375, 0.0, -0.3125]",https://www.nytimes.com/2016/01/01/sports/baseball/why-fans-stand-by-perennial-losers.html,Kids who succeed academically deserve scholarships more then kids on sports teams It's all about the money.
37,"The Red Storm dropped their Big East Conference opener on Thursday. Still Mullin, the St. John’s basketball legend turned first-year coach, sees signs of improvement.",2016,"[0.75, 0.26666666666666666, 0.4666666666666666, 0.0, 0.04999999999999999, 0.0]",https://www.nytimes.com/2016/01/01/sports/chris-mullin-sees-mixed-signs-in-st-johns-loss.html,The Red Storm dropped their Big East Conference opener on Thursday.
38,"Legal experts said the road to conviction was filled with significant hurdles, including a lack of forensic evidence related to the decade-old allegation by the woman at the center of the case.",2016,"[-0.22500000000000003, 0.27249999999999996, -0.35, -0.2, 0.037229643765903306, 0.25, -0.00442048517520216, -0.12, 0.0, 0.0, 0.0, -0.09375, -0.24999999999999992]",https://www.nytimes.com/2016/01/01/us/experts-foresee-obstacles-for-both-sides-in-bill-cosby-case.html,"Scottish IT expert Gary McKinnon claims he found evidence of contact with 'non-terrestrial' beings and technology on NASA and US Navy computer systems Scottish IT expert Gary McKinnon, now 57, illegally gained access to US Army, Navy, Air Force, Pentagon, and NASA computers in 2002."
39,"Start the New Year on the right foot with a hike to Shadow Lake, a guided bird tour in the Bronx, or with another recreational activity.",2016,"[0.0, 0.0, 0.125, 0.2857142857142857, -0.7, 0.0, -0.0033333333333333383, 0.11818181818181818, 0.0, 0.0625, 0.625, 0.125, 0.3974431818181818, 0.0875, 0.0]",https://www.nytimes.com/2016/01/03/nyregion/things-to-do-in-the-hudson-valley-jan-2-through-10.html,"Start the New Year on the right foot with a hike to Shadow Lake, a guided bird tour in the Bronx, or with another recreational activity."
40,"As the new year approached on Thursday, the police in Munich evacuated two train stations and warned residents to avoid large groups, citing “concrete hints” about a possible attack.",2016,"[-0.5, -0.08333333333333333, -0.0019972451790633613, 0.20887445887445888, 0.16178571428571428, 0.05190476190476192, 0.02777777777777778, 0.0, -0.35, 0.046666666666666676, 0.18541666666666667, -0.7999999999999999, 0.0, -0.525, -0.375]",https://www.nytimes.com/2016/01/01/world/europe/monitoring-of-terrorism-threats-has-risen-official-says.html,"Paris police say suspect in train station attack that injured 3 may have mental health issues TLDR >PARIS (AP) — A man armed with a knife and a hammer wounded three people Saturday in an early morning attack at the bustling Gare de Lyon train station in Paris, another nerve-rattling security incident in the Olympics host city before the Summer Games open in six months."
41,The comedian Kathleen Madigan will perform on Jan. 7 at 7:30 p.m. at the Bushnell Center for the Performing Arts.,2016,"[0.0, 0.16448277417027418, -0.10000000000000002, 0.0, 0.0, 0.2777777777777778, 0.044196428571428574, 0.0, 0.0, 0.0, 0.15, -0.125, 0.018181818181818174, 0.028125000000000004, -0.225]",https://www.nytimes.com/2016/01/03/nyregion/things-to-do-in-connecticut-jan-2-through-10.html,The comedian Kathleen Madigan will perform on Jan. 7 at 7:30 p.m. at the Bushnell Center for the Performing Arts. Automated floor transformation at Tobin Center for the Performing Arts For additional insight check out [this comment by /u/colcob](https://www.reddit.com/r/EngineeringPorn/comments/n58u8n/automated_floor_transformation_at_tobin_center/gx0ujdu/?context=3) and [this one by /u/ThatEagerHero](https://www.reddit.com/r/EngineeringPorn/comments/n58u8n/automated_floor_transformation_at_tobin_center/gx1aos8/?context=3).
42,Cultural events on Long Island include an evening with champion storytellers Lesley Goshko and Michele Carlo and “Dreamgirls” perform in East Islip.,2016,"[0.3333333333333333, 0.3875, 0.10128787878787877, -0.04777777777777777, 0.0, 0.1, 0.2546464646464647, 0.25, 0.0, 0.25, -0.175, 0.16666666666666666, -0.15, 0.20408163265306123, 0.26926406926406926]",https://www.nytimes.com/2016/01/03/nyregion/things-to-do-on-long-island-jan-2-through-10.html,"Summary of Formu1a.uno's Twitch stream on more inside knowledge about Lewis Hamilton's move to Scuderia Ferrari As a general rule ([see full rules](https://www.reddit.com/r/formula1/wiki/userguide#wiki_sticky.2Fdaily_discussion)), a standalone Discussion post should: - be of interest to the sub in general, and not a specific userbase (e.g. new users, GP attendees, just yourself) - be able to generate discussion (e.g. no yes/no or easily answerable questions) - show reasonable input and effort from the OP If not, be sure to [look for the Daily Discussion](https://www.reddit.com/r/formula1/search/?q=daily+discussion&include_over_18=on&restrict_sr=on&t=all&sort=new), /r/formula1's daily open question thread which is perfect for asking any and all questions about this sport."
43,"“Secrets of War,” a drama set in the Nazi-occupied Netherlands directed by Dennis Bots, will be shown this month at the Summit Free Public Library.",2016,"[0.26666666666666666, 0.5125, 0.25, 0.25, 0.0, 0.0, 0.0, 0.875, 0.0, 0.2125, 0.25]",https://www.nytimes.com/2016/01/03/nyregion/things-to-do-in-new-jersey-jan-2-through-10.html,"“Secrets of War,” a drama set in the Nazi-occupied Netherlands directed by Dennis Bots, will be shown this month at the Summit Free Public Library."
