Article ID,Title,Year,Sentiment List,URL,Summary
44,"If approved, the contract would include an 11 percent raise over seven years and measures that would enable more efficient prosecution of inmates who assault officers at Rikers Island.",2016,"[-0.17499999999999996, 0.0, -0.5, -0.049999999999999996, 0.09523809523809523, 0.0]",https://www.nytimes.com/2016/01/01/nyregion/new-york-city-correction-officers-reach-tentative-contract-deal.html,"NY Post Rikers Island Inmate Death: 4th Reported This Year A Rikers Island correction officer didn’t realize his body cam was on — and filmed himself planting a pointed shard of Plexiglas in an inmate’s cell and then pretending he found it, officials say."
45,Two professional women’s teams faced off for the first time at the N.H.L.’s marquee regular-season event.,2016,"[-0.3666666666666667, 0.0, 0.10625, 0.0, 0.0, 0.0]",https://www.nytimes.com/2016/01/01/sports/hockey/winter-classic-boston-pride-les-canadiennes.html,Two professional women’s teams faced off for the first time at the N.H.L.’s marquee regular-season event.
46,"Welcome to the first crossword puzzle of 2016, a lively themeless puzzle by David Steinberg.",2016,"[-0.2916666666666667, 0.0, 0.0, 0.78125, 0.0, 0.125, -0.2833333333333333, -0.55, 0.18496162927981105, 0.0, 0.0, -0.625, 0.11078787878787878, 0.0, 0.03333333333333344]",https://wordplay.blogs.nytimes.com/2015/12/31/scream-ones-head-off/,"Welcome to the first crossword puzzle of 2016, a lively themeless puzzle by David Steinberg."
47,"Hugo Galindo had planned to watch the ball drop in Times Square. But early Thursday morning, he was beaten and stabbed just blocks from his home.",2016,"[0.3625, 0.2, -0.5833333333333334, 1.0, 0.0, 0.5, 0.0, 0.10000000000000002, 0.0, 0.0, 0.1, 0.0, 0.8, 0.0, 0.0]",https://www.nytimes.com/2016/01/01/nyregion/bronx-man-a-father-figure-in-his-family-is-fatally-attacked-by-6-men.html,Hugo Galindo had planned to watch the ball drop in Times Square.
48,New Year’s Eve celebrations sparkled across the globe.,2016,"[0.0, 0.31666666666666665, 0.16767676767676767, 0.0, 0.21103896103896103, 0.0, 0.0, 0.0, 0.625, -0.09999999999999998, -0.2, 0.0, 0.0625, 0.19999999999999998, 0.05]",https://www.nytimes.com/slideshow/2015/12/31/nyregion/lighting-up-the-night-and-the-new-year.html,Young Muslims take to streets to clean up after New Year’s Eve celebrations only Muslims took to the streets to clean up after new years?
49,"Mr. Rogers was on the show for just the first three of its 11 seasons as the army surgeon Trapper John, but his run, and his character, are especially revered by show devotees.",2016,"[0.0, -0.1, 0.07738095238095238, 0.19999999999999998, 0.09722222222222222, 0.0, 0.16666666666666666, 0.125, -0.11249999999999999, 0.17290234275528393, 0.0, 0.19288888888888892, 0.0, 0.0, 0.0]",https://www.nytimes.com/2016/01/01/nyregion/wayne-rogers-82-actor-in-tv-show-mash.html,Mr. Rogers brought a special needs child on his show and showed the world how to treat them with kindness.
50,"Three adults were killed and three others were severely injured when a tractor-trailer struck their S.U.V. on an icy highway, the police said.",2016,"[0.1125, 0.0, 0.0, 0.0, 0.16666666666666666, -0.125, -0.06999999999999999, 0.0, 0.5, 0.0, 0.3, 0.0, 0.0, -0.0062500000000000056, 0.11250000000000002]",https://www.nytimes.com/2016/01/01/nyregion/a-hastings-on-hudson-couple-and-a-friend-die-in-a-head-on-crash-in-vermont.html,"Three adults were killed and three others were severely injured when a tractor-trailer struck their S.U.V. on an icy highway, the police said."
51,"Three adults were killed and three others were severely injured when a tractor-trailer struck their S.U.V. on an icy highway, the police said.",2017,"[0.1125, 0.0, 0.0, 0.0, 0.16666666666666666, -0.125, -0.06999999999999999, 0.0, 0.5, 0.0, 0.3, 0.0, 0.0, -0.0062500000000000056, 0.11250000000000002]",https://www.nytimes.com/2016/01/01/nyregion/a-hastings-on-hudson-couple-and-a-friend-die-in-a-head-on-crash-in-vermont.html,"Three adults were killed and three others were severely injured when a tractor-trailer struck their S.U.V. on an icy highway, the police said."
52,"Three adults were killed and three others were severely injured when a tractor-trailer struck their S.U.V. on an icy highway, the police said.",2018,"[0.1125, 0.0, 0.0, 0.0, 0.16666666666666666, -0.125, -0.06999999999999999, 0.0, 0.5, 0.0, 0.3, 0.0, 0.0, -0.0062500000000000056, 0.11250000000000002]",https://www.nytimes.com/2016/01/01/nyregion/a-hastings-on-hudson-couple-and-a-friend-die-in-a-head-on-crash-in-vermont.html,"Three adults were killed and three others were severely injured when a tractor-trailer struck their S.U.V. on an icy highway, the police said."
53,Can greater defenses be erected? Should homes be vaulted on stilts? Or is it time for some communities to pack up and leave?,2019,"[0.2878427128427129, 0.16, 0.050811688311688315, 0.09435064935064935, -0.5, -0.16666666666666666, 0.0, -0.006249999999999999, 0.0625, 0.046428571428571416, 0.16666666666666669, 0.24285714285714283, 0.0, 0.08833333333333332, -0.8]",https://www.nytimes.com/2016/01/01/us/flooding-in-missouri-raises-vexing-questions.html,Defensive firearms for first-time gun owners: a comprehensive guide to selecting and buying a gun for home defense.
