Article ID,Title,Sentiment List,URL,Summary
1,Democrats Hammer a Simple Attack on Abortion: Donald Trump Did This,"[-0.07777777777777778, -0.03420244107744107, -0.02149621212121212, 0.0, 0.002777777777777777, 0.025, 0.10604332010582011, 0.1075, 0.1261111111111111, 0.15, 0.16666666666666666, 0.175, 0.19999999999999998, 0.23750000000000002, 0.31785714285714284, 0.325, 0.375, 0.425]",https://www.nytimes.com/2024/04/11/us/politics/kamala-harris-abortion-biden-democrats.html,"You make a lot of points I question but one thing you bring up is interesting, without McConnell the senate GOP is dead and without his general leadership, the election map for Republicans is a series of coin flips."
2,"Trump to Meet an Embattled Johnson, Putting Their Tortured Ties on Display","[-0.08333333333333333, -0.0763888888888889, 0.0, 0.0, 0.0, 0.0, 0.0, 0.0, 0.017857142857142856, 0.09285714285714286, 0.1, 0.10666666666666666, 0.125, 0.15, 0.15714285714285714, 0.17837301587301585, 0.21666666666666665, 0.24285714285714285, 0.25, 0.2700892857142857, 0.3431818181818182, 0.35, 0.41190476190476194, 0.5]",https://www.nytimes.com/2024/04/11/us/politics/trump-johnson-elections-congress.html,"It's really important to note here that Trump didn't just want the investigations launched, he wanted **public statements from Ukraine's president that the investigations were going to be launched**."
3,"O.J. Simpson, Football Star Whose Trial Riveted the Nation, Dies at 76","[-0.375, -0.17121212121212123, -0.15625, -0.13333333333333333, -0.1, -0.07361111111111111, 0.0, 0.0, 0.0, 0.0, 0.0, 0.2, 0.20833333333333334, 0.3, 0.7]",https://www.nytimes.com/2024/04/11/sports/oj-simpson-dead.html,He was the only one searching for the real killers.
4,"O.J., Made in America, Made by TV","[-0.8999999999999999, -0.32857142857142857, -0.1875, -0.10857843137254904, -0.10416666666666667, -0.1, -0.08333333333333336, -0.05, -0.027083333333333324, -0.012962962962962966, 0.0, 0.0, 0.0, 0.0, 0.0, 0.0, 0.0, 0.016578947368421054, 0.05555555555555555, 0.1465909090909091, 0.14791666666666667, 0.16666666666666666, 0.2, 0.20833333333333334, 0.23333333333333334, 0.2583333333333333, 0.26, 0.375, 0.55, 0.6]",https://www.nytimes.com/2024/04/11/arts/television/oj-simpson-tv-football-trial.html,Please remember that this subreddit is for sharing propaganda to view with some objectivity and interest.
5,How Hertz Turned O.J. Simpson Into the ‘Superstar in Rent‐a‐Car’,"[-0.3, -0.2, -0.16250000000000003, -0.03194444444444445, 0.0, 0.0, 0.10619791666666667, 0.12380952380952381, 0.14659090909090908, 0.19910714285714287, 0.21875, 0.26000000000000006, 0.3178125, 0.375, 0.5]",https://www.nytimes.com/2024/04/11/arts/television/oj-simpson-hertz-ads-commercials.html,"So that when need outlets report on the appeal, people will have something to look back on."
6,The Life of O.J. Simpson: A Timeline,"[-0.07142857142857142, 0.0, 0.0, 0.0, 0.0, 0.0, 0.0, 0.0, 0.0, 0.12222222222222223, 0.18, 0.2, 0.25]",https://www.nytimes.com/2024/04/11/us/oj-simpson-timeline.html,The world feels just a bit cleaner after that trash has left.
7,Dish Soap to Help Build Planes? Boeing Signs Off on Supplier’s Method.,"[-0.08095238095238098, -0.013333333333333341, 0.0, 0.0, 0.0, 0.0, 0.0, 0.03199999999999999, 0.1, 0.8, 0.9099999999999999, 1.0]",https://www.nytimes.com/2024/04/11/us/politics/spirit-aerosystems-boeing-737-max.html,apply dish soap to pad.
8,U.S. Sends a Top General to Israel Amid Fears of Iranian Strikes,"[-0.8, -0.31666666666666665, -0.15, 0.0, 0.0, 0.0, 0.0, 0.0, 0.017307692307692295, 0.075, 0.1983333333333333, 0.55]",https://www.nytimes.com/2024/04/11/world/middleeast/israel-iran-hamas-strikes.html,"""**The U.S. is sending a fresh round of bombs to Israel, two senior administration officials told NBC News, undermining the Biden administration’s public expressions of frustration at Israel’s conduct in the war and its own efforts at brokering a cease-fire.**"
9,What Happens When There Is No Food: Experts Say Severe Malnutrition Could Set in Swiftly in Gaza,"[0.0, 0.0, 0.3625]",https://www.nytimes.com/2024/01/11/health/gaza-hunger-starvation.html,But I thought Israel was not restricting aid !
10,NPR in Turmoil After It Is Accused of Liberal Bias,"[-0.6999999999999998, -0.5, -0.21875, -0.1, -0.05, -0.0014285714285714346, 0.0, 0.0, 0.0, 0.0, 0.0, 4.336808689942018e-18, 0.1115079365079365, 0.11460317460317461, 0.13712121212121212, 0.18867063492063493, 0.20625, 0.2333333333333333, 0.3578030303030303]",https://www.nytimes.com/2024/04/11/business/media/npr-criticism-liberal-bias.html,> AP admits widely panned story on Harvard plagiarism didn't meet standards
